complete_address,city,price_total,price,rent,rent_sqm,sqm,is_furnished,coords,travel_time
"ul. Józefa Ryszki, Klimzowiec, Centrum, Chorzów, śląskie","Chorzów, śląskie",2020.0,1400.0,620.0,63.12,32.0,True,"(50.2537455, 18.9383126)",40
"ul. Jana Kasperka, Śródmieście, Bytom, śląskie","Bytom, śląskie",1600.0,1000.0,600.0,45.71,35.0,False,"(50.342812, 18.9120743)",31
"Siewierz, Siewierz, będziński, śląskie","będziński, śląskie",2400.0,1950.0,450.0,66.67,36.0,False,"(50.47924, 19.2374613)",20
"ul. Paryska, Śródmieście, Śródmieście, Dąbrowa Górnicza, śląskie","Dąbrowa Górnicza, śląskie",2230.0,1650.0,580.0,41.3,54.0,True,"(50.330374, 19.1848234)",32
"ul. Powstańców Warszawskich, Śródmieście, Bytom, śląskie","Bytom, śląskie",1100.0,1100.0,,31.43,35.0,False,"(50.342812, 18.9120743)",31
"ul. Stanisława Moniuszki, Śródmieście, Katowice, śląskie","Katowice, śląskie",2100.0,1600.0,500.0,95.45,22.0,True,"(50.2576071, 19.0171456)",38
"ul. Opolska 10, Śródmieście, Katowice, śląskie","Katowice, śląskie",3700.0,2900.0,800.0,68.52,54.0,True,"(50.2576071, 19.0171456)",38
"Myszków, myszkowski, śląskie","myszkowski, śląskie",2450.0,1750.0,700.0,48.04,51.0,False,"(50.5743116, 19.3290231)",39
"Śródmieście, Katowice, śląskie","Katowice, śląskie",4400.0,4400.0,,48.89,90.0,False,"(50.259795, 19.0217063)",37
"ul. Cypriana Kamila Norwida, Aleje, Reden, Dąbrowa Górnicza, śląskie","Dąbrowa Górnicza, śląskie",1900.0,1899.0,1.0,37.25,51.0,False,"(50.330374, 19.1848234)",32
"ul. ks. Augustynika, Reden, Reden, Dąbrowa Górnicza, śląskie","Dąbrowa Górnicza, śląskie",5900.0,5900.0,,49.17,120.0,False,"(50.330374, 19.1848234)",32
"ul. Giszowiecka, Giszowiec, Katowice, śląskie","Katowice, śląskie",1345.0,1100.0,245.0,84.06,16.0,False,"(50.2576071, 19.0171456)",38
"ul. Wiertnicza, Dąbrówka Mała, Katowice, śląskie","Katowice, śląskie",2840.0,2290.0,550.0,56.8,50.0,True,"(50.2576071, 19.0171456)",38
"Śródmieście, Bytom, śląskie","Bytom, śląskie",3500.0,3500.0,,30.97,113.0,True,"(50.3593826, 18.9223843)",26
"Kasprzak, Gołonóg Południowy, Dąbrowa Górnicza, śląskie","Dąbrowa Górnicza, śląskie",2600.0,2600.0,,59.09,44.0,False,"(50.330374, 19.1848234)",32
"ul. Juliana Ordona, Koszutka, Katowice, śląskie","Katowice, śląskie",1500.0,1500.0,,45.45,33.0,True,"(50.2576071, 19.0171456)",38
"Dąb, Katowice, śląskie","Katowice, śląskie",2700.0,2700.0,,58.7,46.0,True,"(50.27602295, 18.99200291024328)",38
"Zagórze Południe, Sosnowiec, śląskie","Sosnowiec, śląskie",1501.0,1500.0,1.0,22.4,67.0,False,"(50.27895, 19.1263859)",35
"al. Tadeusza Kościuszki, Śródmieście, Śródmieście, Dąbrowa Górnicza, śląskie","Dąbrowa Górnicza, śląskie",2560.0,1800.0,760.0,51.2,50.0,True,"(50.3250888, 19.1864265)",32
"Czeladź, będziński, śląskie","będziński, śląskie",2060.0,1600.0,460.0,42.04,49.0,False,"(50.31879875, 19.09582409097177)",29
"ul. ks. bp. Czesława Domina, Michałkowice, Siemianowice Śląskie, śląskie","Siemianowice Śląskie, śląskie",4479.0,3800.0,679.0,57.42,78.0,True,"(50.2987309, 19.035211)",31
"ul. Józefa Ignacego Kraszewskiego, Klimontów, Sosnowiec, śląskie","Sosnowiec, śląskie",1699.0,1099.0,600.0,44.71,38.0,False,"(50.27895, 19.1263859)",35
"ul. 1 Maja, Zawodzie, Katowice, śląskie","Katowice, śląskie",1200.0,1200.0,,80.0,15.0,False,"(50.2576071, 19.0171456)",38
"ul. Strzelców Bytomskich, Śródmieście, Bytom, śląskie","Bytom, śląskie",1350.0,1250.0,100.0,54.0,25.0,False,"(50.342812, 18.9120743)",31
"Śródmieście, Katowice, śląskie","Katowice, śląskie",2700.0,2700.0,,28.42,95.0,True,"(50.259795, 19.0217063)",37
"ul. Józefa Gallusa, Załęska Hałda-Brynów, Katowice, śląskie","Katowice, śląskie",2910.0,2100.0,810.0,64.67,45.0,True,"(50.2576071, 19.0171456)",38
"pl. Wojska Polskiego, Śródmieście, Bytom, śląskie","Bytom, śląskie",1980.0,1450.0,530.0,58.24,34.0,True,"(50.3539868, 18.9297494)",25
"ul. Walentyny Tierieszkowej, Gołonóg, Gołonóg Północny, Dąbrowa Górnicza, śląskie","Dąbrowa Górnicza, śląskie",1300.0,1300.0,,43.33,30.0,True,"(50.330374, 19.1848234)",32
"Śródmieście, Katowice, śląskie","Katowice, śląskie",3000.0,3000.0,,20.69,145.0,False,"(50.259795, 19.0217063)",37
"Centrum / Śródmieście, Sosnowiec, śląskie","Sosnowiec, śląskie",2000.0,1300.0,700.0,38.46,52.0,False,"(50.30136995, 19.137234784534655)",28
"ul. Stanisława Rochowiaka, Śródmieście, Katowice, śląskie","Katowice, śląskie",1250.0,850.0,400.0,83.33,15.0,False,"(50.2576071, 19.0171456)",38
"ul. Fryderyka Chopina, Śródmieście, Katowice, śląskie","Katowice, śląskie",3500.0,3500.0,,62.5,56.0,True,"(50.2576071, 19.0171456)",38
"ul. Bytkowska, Wełnowiec-Józefowiec, Katowice, śląskie","Katowice, śląskie",2600.0,2100.0,500.0,65.0,40.0,True,"(50.2576071, 19.0171456)",38
"Pogoń, Sosnowiec, śląskie","Sosnowiec, śląskie",2250.0,1800.0,450.0,47.87,47.0,False,"(50.301919850000004, 19.132456365631022)",28
"ul. Juliusza Słowackiego, Śródmieście, Katowice, śląskie","Katowice, śląskie",2670.0,1800.0,870.0,62.09,43.0,True,"(50.2576071, 19.0171456)",38
"ul. Zygmunta Krasińskiego, Aleje, Reden, Dąbrowa Górnicza, śląskie","Dąbrowa Górnicza, śląskie",2200.0,1600.0,600.0,44.0,50.0,True,"(50.330374, 19.1848234)",32
"Ząbkowice, Ząbkowice, Dąbrowa Górnicza, śląskie","Dąbrowa Górnicza, śląskie",2603.0,2600.0,3.0,57.84,45.0,False,"(50.3665939, 19.2646845)",25
"Dąb, Katowice, śląskie","Katowice, śląskie",3050.0,3050.0,,50.83,60.0,False,"(50.27602295, 18.99200291024328)",38
"Aleje, Reden, Dąbrowa Górnicza, śląskie","Dąbrowa Górnicza, śląskie",2063.0,1500.0,563.0,40.45,51.0,False,"(50.330374, 19.1848234)",32
"Śródmieście, Bytom, śląskie","Bytom, śląskie",3550.0,3000.0,550.0,28.4,125.0,False,"(50.3593826, 18.9223843)",26
"Goląsza, Psary, będziński, śląskie","będziński, śląskie",700.0,700.0,,11.67,60.0,False,"(50.3965706, 19.1024097)",17
"ul. Zagłębiowska, Niwka, Sosnowiec, śląskie","Sosnowiec, śląskie",2200.0,1600.0,600.0,62.86,35.0,False,"(50.27895, 19.1263859)",35
"Wełnowiec-Józefowiec, Katowice, śląskie","Katowice, śląskie",3100.0,2400.0,700.0,65.96,47.0,True,"(50.2911077, 19.00786748480725)",35
"Dąb, Katowice, śląskie","Katowice, śląskie",3201.0,3200.0,1.0,53.35,60.0,True,"(50.27602295, 18.99200291024328)",38
"ul. Sokolska 30, Śródmieście, Katowice, śląskie","Katowice, śląskie",2590.0,2100.0,490.0,80.94,32.0,False,"(50.2576071, 19.0171456)",38
"Stary Sosnowiec, Sosnowiec, śląskie","Sosnowiec, śląskie",1801.0,1800.0,1.0,27.71,65.0,False,"(50.2822072, 19.1189568)",32
"ul. Ostrogórska, Centrum / Śródmieście, Sosnowiec, śląskie","Sosnowiec, śląskie",1600.0,1600.0,,42.11,38.0,True,"(50.27895, 19.1263859)",35
"Sielec, Sosnowiec, śląskie","Sosnowiec, śląskie",1650.0,850.0,800.0,43.42,38.0,True,"(50.2761303, 19.1408973)",37
"ul. Bytomska, Piekary Śląskie, śląskie","Piekary Śląskie, śląskie",1001.0,1000.0,1.0,13.17,76.0,False,"(50.3686759, 18.9325362)",25
"ul. Sokołów, Piekary Śląskie, śląskie","Piekary Śląskie, śląskie",1350.0,800.0,550.0,29.35,46.0,True,"(50.3686759, 18.9325362)",25
"ul. ks. Franciszka Nawrota, Śródmieście, Bytom, śląskie","Bytom, śląskie",1900.0,1500.0,400.0,23.75,80.0,True,"(50.342812, 18.9120743)",31
"ul. Katowicka, Chorzów II, Chorzów, śląskie","Chorzów, śląskie",1850.0,1700.0,150.0,61.67,30.0,True,"(50.2537455, 18.9383126)",40
"ul. Juliana Ordona, Koszutka, Katowice, śląskie","Katowice, śląskie",2300.0,1700.0,600.0,53.49,43.0,True,"(50.2576071, 19.0171456)",38
"ul. Klonowa, Jaworzno, śląskie","Jaworzno, śląskie",1550.0,1200.0,350.0,46.97,33.0,False,"(50.2175346, 19.2571794)",46
"ul. Meteorologów, Brynów-Osiedle Zgrzebnioka, Katowice, śląskie","Katowice, śląskie",2800.0,2300.0,500.0,90.32,31.0,True,"(50.2576071, 19.0171456)",38
"ul. Czeladzka, Pogoń, Sosnowiec, śląskie","Sosnowiec, śląskie",900.0,900.0,,30.0,30.0,False,"(50.27895, 19.1263859)",35
"ul. Meteorologów, Brynów-Osiedle Zgrzebnioka, Katowice, śląskie","Katowice, śląskie",4300.0,3500.0,800.0,63.24,68.0,True,"(50.2576071, 19.0171456)",38
"al. Józefa Piłsudskiego, Siewierz, Siewierz, będziński, śląskie","będziński, śląskie",2200.0,2200.0,,75.86,29.0,True,"(50.31724945, 19.138881491319484)",32
"Środula, Sosnowiec, śląskie","Sosnowiec, śląskie",2310.0,2100.0,210.0,67.94,34.0,True,"(50.3072222, 19.1569444)",32
"Pogoń, Sosnowiec, śląskie","Sosnowiec, śląskie",1900.0,1200.0,700.0,41.3,46.0,True,"(50.301919850000004, 19.132456365631022)",28
"ul. Plebiscytowa, Śródmieście, Katowice, śląskie","Katowice, śląskie",1990.0,1990.0,,53.78,37.0,True,"(50.2576071, 19.0171456)",38
"ul. Zabrska, Śródmieście, Katowice, śląskie","Katowice, śląskie",3790.0,3790.0,,44.59,85.0,False,"(50.2576071, 19.0171456)",38
"Siewierz, Siewierz, będziński, śląskie","będziński, śląskie",3050.0,2500.0,550.0,78.21,39.0,True,"(50.47924, 19.2374613)",20
"Śródmieście, Bytom, śląskie","Bytom, śląskie",1700.0,1200.0,500.0,44.74,38.0,False,"(50.3593826, 18.9223843)",26
"ul. Powstańców, Centrum, Chorzów, śląskie","Chorzów, śląskie",950.0,950.0,,73.08,13.0,False,"(50.2537455, 18.9383126)",40
"ul. Katowicka, Mysłowice, śląskie","Mysłowice, śląskie",1350.0,1350.0,,30.68,44.0,True,"(50.2171942, 19.1235153)",36
"ul. Józefowska, Wełnowiec-Józefowiec, Katowice, śląskie","Katowice, śląskie",2251.0,2250.0,1.0,37.52,60.0,True,"(50.2576071, 19.0171456)",38
"ul. Wojciecha, Giszowiec, Katowice, śląskie","Katowice, śląskie",2501.0,2500.0,1.0,41.68,60.0,True,"(50.2576071, 19.0171456)",38
"ul. Powstańców, Centrum, Chorzów, śląskie","Chorzów, śląskie",950.0,950.0,,73.08,13.0,False,"(50.2537455, 18.9383126)",40
"Osiedle Tysiąclecia, Katowice, śląskie","Katowice, śląskie",3346.0,2690.0,656.0,79.67,42.0,False,"(50.2727182, 18.9824049)",41
"ul. Jagiellońska, Centrum / Śródmieście, Sosnowiec, śląskie","Sosnowiec, śląskie",1200.0,1200.0,,33.33,36.0,True,"(50.27895, 19.1263859)",35
"ul. Podjazdowa, Milowice, Sosnowiec, śląskie","Sosnowiec, śląskie",650.0,650.0,,29.55,22.0,True,"(50.27895, 19.1263859)",35
"Klimontów, Sosnowiec, śląskie","Sosnowiec, śląskie",1600.0,1600.0,,40.0,40.0,False,"(50.2810071, 19.19456500889759)",35
"Koszutka, Katowice, śląskie","Katowice, śląskie",2300.0,2300.0,,63.89,36.0,False,"(50.2679049, 19.0216151)",36
"Henryka Mikołaja Góreckiego, Bogucice, Katowice, śląskie","Katowice, śląskie",2716.0,2400.0,316.0,87.61,31.0,True,"(50.2576071, 19.0171456)",38
"Będzin, będziński, śląskie","będziński, śląskie",1900.0,1450.0,450.0,63.33,30.0,True,"(50.3089738, 19.14141)",30
"ul. Juliusza Słowackiego, Śródmieście, Katowice, śląskie","Katowice, śląskie",2263.0,2000.0,263.0,75.43,30.0,True,"(50.2576071, 19.0171456)",38
"ul. marsz. Józefa Piłsudskiego, Stary Sosnowiec, Sosnowiec, śląskie","Sosnowiec, śląskie",2000.0,1800.0,200.0,21.05,95.0,True,"(50.27895, 19.1263859)",35
"Śródmieście, Katowice, śląskie","Katowice, śląskie",2450.0,2000.0,450.0,68.06,36.0,True,"(50.259795, 19.0217063)",37
"ul. Żwirki i Wigury, Śródmieście, Katowice, śląskie","Katowice, śląskie",5646.0,4900.0,746.0,56.46,100.0,False,"(50.2576071, 19.0171456)",38
"ul. Karola Szymanowskiego, Zagórze Północ, Sosnowiec, śląskie","Sosnowiec, śląskie",1300.0,1300.0,,44.83,29.0,True,"(50.27895, 19.1263859)",35
"ul. Adama Śliwki, Niwka, Sosnowiec, śląskie","Sosnowiec, śląskie",2300.0,1800.0,500.0,65.71,35.0,True,"(50.27895, 19.1263859)",35
"ul. Zagłębiowska, Niwka, Sosnowiec, śląskie","Sosnowiec, śląskie",2650.0,2100.0,550.0,56.38,47.0,True,"(50.27895, 19.1263859)",35
"ul. Rzeszowska, Będzin, będziński, śląskie","będziński, śląskie",2700.0,2000.0,700.0,56.25,48.0,True,"(50.31724945, 19.138881491319484)",32
"ul. ks. bp. Herberta Bednorza, Szopienice-Burowiec, Katowice, śląskie","Katowice, śląskie",2000.0,2000.0,,62.5,32.0,True,"(50.2576071, 19.0171456)",38
"ul. Powstańców Warszawskich, Piekary Śląskie, śląskie","Piekary Śląskie, śląskie",1340.0,900.0,440.0,37.22,36.0,False,"(50.3686759, 18.9325362)",25
"Henryka Mikołaja Góreckiego, Bogucice, Katowice, śląskie","Katowice, śląskie",2799.0,2199.0,600.0,90.29,31.0,True,"(50.2576071, 19.0171456)",38
"ul. Augustyna Świdra, Chorzów II, Chorzów, śląskie","Chorzów, śląskie",850.0,850.0,,34.0,25.0,False,"(50.2537455, 18.9383126)",40
"Rozbark, Bytom, śląskie","Bytom, śląskie",1450.0,1050.0,400.0,55.77,26.0,False,"(50.341924000000006, 18.926691889543118)",29
"ul. Powstańców Warszawskich, Piekary Śląskie, śląskie","Piekary Śląskie, śląskie",900.0,900.0,,25.0,36.0,False,"(50.3686759, 18.9325362)",25
"ul. gen. Józefa Hallera, Śródmieście, Katowice, śląskie","Katowice, śląskie",2000.0,1400.0,600.0,48.78,41.0,False,"(50.2576071, 19.0171456)",38
"ul. Krakowska, Śródmieście, Bytom, śląskie","Bytom, śląskie",800.0,800.0,,25.0,32.0,False,"(50.342812, 18.9120743)",31
"ul. Klonowa, Śródmieście, Bytom, śląskie","Bytom, śląskie",1900.0,1900.0,,28.79,66.0,True,"(50.342812, 18.9120743)",31
"Centrum, Chorzów, śląskie","Chorzów, śląskie",750.0,750.0,,30.0,25.0,False,"(50.2916931, 18.942978)",39
"ul. Opolska, Śródmieście, Katowice, śląskie","Katowice, śląskie",2600.0,2600.0,,76.47,34.0,False,"(50.2576071, 19.0171456)",38
"Stary Sosnowiec, Sosnowiec, śląskie","Sosnowiec, śląskie",3014.0,2600.0,414.0,51.08,59.0,True,"(50.2822072, 19.1189568)",32
"Klimontów, Sosnowiec, śląskie","Sosnowiec, śląskie",1008.0,1008.0,,22.91,44.0,False,"(50.2810071, 19.19456500889759)",35
"ul. Szczecińska, Klimzowiec, Centrum, Chorzów, śląskie","Chorzów, śląskie",1949.0,1450.0,499.0,60.91,32.0,True,"(50.2537455, 18.9383126)",40
"al. Wojciecha Korfantego, Wełnowiec-Józefowiec, Katowice, śląskie","Katowice, śląskie",2400.0,2400.0,,60.0,40.0,True,"(50.2757668, 19.0231629)",36
"Śródmieście, Bytom, śląskie","Bytom, śląskie",1900.0,1900.0,,44.19,43.0,False,"(50.3593826, 18.9223843)",26
"Śródmieście, Bytom, śląskie","Bytom, śląskie",1600.0,1600.0,,40.0,40.0,False,"(50.3593826, 18.9223843)",26
"ul. gen. Władysława Sikorskiego, Osiedle Paderewskiego-Muchowiec, Katowice, śląskie","Katowice, śląskie",3250.0,2500.0,750.0,81.25,40.0,True,"(50.2576071, 19.0171456)",38
"ul. Ceglana, Brynów-Osiedle Zgrzebnioka, Katowice, śląskie","Katowice, śląskie",2499.0,2499.0,,56.8,44.0,True,"(50.2576071, 19.0171456)",38
"Zawodzie, Katowice, śląskie","Katowice, śląskie",1900.0,1900.0,,54.29,35.0,True,"(50.2614914, 19.067081658699383)",36
"al. Wojciecha Korfantego, Śródmieście, Katowice, śląskie","Katowice, śląskie",2400.0,1800.0,600.0,52.17,46.0,True,"(50.2623308, 19.0217115)",38
"Koszutka, Katowice, śląskie","Katowice, śląskie",1500.0,1500.0,,42.86,35.0,False,"(50.2679049, 19.0216151)",36
"Śródmieście, Bytom, śląskie","Bytom, śląskie",1200.0,1200.0,,24.0,50.0,False,"(50.3593826, 18.9223843)",26
"Śródmieście, Bytom, śląskie","Bytom, śląskie",2000.0,2000.0,,20.2,99.0,False,"(50.3593826, 18.9223843)",26
"ul. Bartosza Głowackiego, Rozbark, Bytom, śląskie","Bytom, śląskie",1870.0,1400.0,470.0,55.0,34.0,True,"(50.342812, 18.9120743)",31
"Śródmieście, Śródmieście, Dąbrowa Górnicza, śląskie","Dąbrowa Górnicza, śląskie",2500.0,2500.0,,52.08,48.0,False,"(50.330374, 19.1848234)",32
"Śródmieście, Katowice, śląskie","Katowice, śląskie",2500.0,2500.0,,55.56,45.0,True,"(50.259795, 19.0217063)",37
"Czeladź, będziński, śląskie","będziński, śląskie",1800.0,1800.0,,35.29,51.0,False,"(50.31879875, 19.09582409097177)",29
"Dąb, Katowice, śląskie","Katowice, śląskie",3201.0,3200.0,1.0,53.35,60.0,True,"(50.27602295, 18.99200291024328)",38
"ul. 1 Maja, Zawodzie, Katowice, śląskie","Katowice, śląskie",2500.0,1800.0,700.0,35.71,70.0,False,"(50.2576071, 19.0171456)",38
"Brynów-Osiedle Zgrzebnioka, Katowice, śląskie","Katowice, śląskie",2500.0,1850.0,650.0,69.44,36.0,True,"(50.2371408, 19.0101608)",44
"ul. Wielka Skotnica, Mysłowice, śląskie","Mysłowice, śląskie",1850.0,1400.0,450.0,66.07,28.0,True,"(50.2171942, 19.1235153)",36
"Śródmieście, Bytom, śląskie","Bytom, śląskie",1750.0,1500.0,250.0,43.75,40.0,False,"(50.3593826, 18.9223843)",26
"Środula, Sosnowiec, śląskie","Sosnowiec, śląskie",1360.0,900.0,460.0,37.78,36.0,True,"(50.3072222, 19.1569444)",32
"ul. Krakowska, Będzin, będziński, śląskie","będziński, śląskie",2100.0,2100.0,,47.73,44.0,True,"(50.31724945, 19.138881491319484)",32
"ul. Żwirki i Wigury, Śródmieście, Katowice, śląskie","Katowice, śląskie",1550.0,1550.0,,86.11,18.0,True,"(50.2576071, 19.0171456)",38
"ul. Wojewódzka, Śródmieście, Katowice, śląskie","Katowice, śląskie",3015.0,2600.0,415.0,22.84,132.0,True,"(50.2576071, 19.0171456)",38
"ul. Warszawska, Śródmieście, Katowice, śląskie","Katowice, śląskie",2990.0,2990.0,,23.92,125.0,False,"(50.2576071, 19.0171456)",38
"ul. Warszawska, Śródmieście, Katowice, śląskie","Katowice, śląskie",1800.0,1800.0,,64.29,28.0,True,"(50.2576071, 19.0171456)",38
"ul. Szybowcowa, Osiedle Paderewskiego-Muchowiec, Katowice, śląskie","Katowice, śląskie",2600.0,2600.0,,55.32,47.0,True,"(50.2576071, 19.0171456)",38
"Środula, Sosnowiec, śląskie","Sosnowiec, śląskie",1900.0,1900.0,,37.25,51.0,True,"(50.3072222, 19.1569444)",32
"ul. Szybowcowa, Osiedle Paderewskiego-Muchowiec, Katowice, śląskie","Katowice, śląskie",4300.0,3500.0,800.0,75.44,57.0,False,"(50.2576071, 19.0171456)",38
"Stary Sosnowiec, Sosnowiec, śląskie","Sosnowiec, śląskie",4500.0,4500.0,,56.25,80.0,True,"(50.2822072, 19.1189568)",32
"ul. Błękitna, Dąb, Katowice, śląskie","Katowice, śląskie",1890.0,1500.0,390.0,75.6,25.0,True,"(50.2576071, 19.0171456)",38
"ul. Michała Grażyńskiego, Koszutka, Katowice, śląskie","Katowice, śląskie",2900.0,2300.0,600.0,60.42,48.0,True,"(50.2576071, 19.0171456)",38
"ul. Wspólna, Centrum / Śródmieście, Sosnowiec, śląskie","Sosnowiec, śląskie",1780.0,1500.0,280.0,59.33,30.0,False,"(50.27895, 19.1263859)",35
"ul. dr. Ignacego Nowaka, Pnioki, Chorzów II, Chorzów, śląskie","Chorzów, śląskie",990.0,990.0,,30.0,33.0,False,"(50.2537455, 18.9383126)",40
"ul. Gabriela Narutowicza, Załęże, Katowice, śląskie","Katowice, śląskie",3800.0,3800.0,,54.29,70.0,True,"(50.2576071, 19.0171456)",38
"Dąb, Katowice, śląskie","Katowice, śląskie",2800.0,2200.0,600.0,93.33,30.0,True,"(50.27602295, 18.99200291024328)",38
"ul. Władysława Grabskiego, Osiedle Witosa, Katowice, śląskie","Katowice, śląskie",2500.0,1700.0,800.0,41.67,60.0,True,"(50.2576071, 19.0171456)",38
"Kasprzak, Gołonóg Południowy, Dąbrowa Górnicza, śląskie","Dąbrowa Górnicza, śląskie",2450.0,2450.0,,53.26,46.0,False,"(50.330374, 19.1848234)",32
"Klimontów, Sosnowiec, śląskie","Sosnowiec, śląskie",750.0,750.0,,17.05,44.0,True,"(50.2810071, 19.19456500889759)",35
"Zagórze Północ, Sosnowiec, śląskie","Sosnowiec, śląskie",2100.0,2100.0,,45.65,46.0,True,"(50.27895, 19.1263859)",35
"Dąb, Katowice, śląskie","Katowice, śląskie",2950.0,2300.0,650.0,52.68,56.0,True,"(50.27602295, 18.99200291024328)",38
"Rozbark, Bytom, śląskie","Bytom, śląskie",1790.0,1500.0,290.0,37.29,48.0,True,"(50.341924000000006, 18.926691889543118)",29
"ul. Sączewskiego, Będzin, będziński, śląskie","będziński, śląskie",2350.0,1850.0,500.0,47.0,50.0,True,"(50.31724945, 19.138881491319484)",32
"ul. Karoliny, Bogucice, Katowice, śląskie","Katowice, śląskie",2850.0,2150.0,700.0,64.77,44.0,False,"(50.2576071, 19.0171456)",38
"Klimontów, Sosnowiec, śląskie","Sosnowiec, śląskie",1327.0,1327.0,,22.88,58.0,False,"(50.2810071, 19.19456500889759)",35
"ul. Towarowa, Centrum / Śródmieście, Sosnowiec, śląskie","Sosnowiec, śląskie",2500.0,2200.0,300.0,43.86,57.0,True,"(50.27895, 19.1263859)",35
"ul. Fryderyka Chopina, Poręba, zawierciański, śląskie","zawierciański, śląskie",1530.0,1000.0,530.0,43.71,35.0,True,"(50.5775652, 19.3412388)",42
"ul. Stefana Batorego, Śródmieście, Bytom, śląskie","Bytom, śląskie",800.0,800.0,,34.78,23.0,True,"(50.342812, 18.9120743)",31
"ul. Wiosenna, Klimzowiec, Centrum, Chorzów, śląskie","Chorzów, śląskie",1290.0,1290.0,,33.95,38.0,True,"(50.2537455, 18.9383126)",40
"Stary Sosnowiec, Sosnowiec, śląskie","Sosnowiec, śląskie",1900.0,1900.0,,52.78,36.0,True,"(50.2822072, 19.1189568)",32
"Brynów-Osiedle Zgrzebnioka, Katowice, śląskie","Katowice, śląskie",3900.0,3900.0,,58.21,67.0,False,"(50.2371408, 19.0101608)",44
"Śródmieście, Katowice, śląskie","Katowice, śląskie",3000.0,3000.0,,20.69,145.0,False,"(50.259795, 19.0217063)",37
"ul. Ceglana, Brynów-Osiedle Zgrzebnioka, Katowice, śląskie","Katowice, śląskie",2499.0,2499.0,,56.8,44.0,True,"(50.2576071, 19.0171456)",38
"al. Walentego Roździeńskiego 90, Dąbrówka Mała, Katowice, śląskie","Katowice, śląskie",900.0,770.0,130.0,90.0,10.0,True,"(50.2752197, 19.0719012)",31
"ul. Wiertnicza, Dąbrówka Mała, Katowice, śląskie","Katowice, śląskie",2249.0,1999.0,250.0,68.15,33.0,False,"(50.2576071, 19.0171456)",38
"ul. Warszawska, Śródmieście, Katowice, śląskie","Katowice, śląskie",2200.0,2200.0,,38.6,57.0,False,"(50.2576071, 19.0171456)",38
"ul. Grodziecka, Czeladź, będziński, śląskie","będziński, śląskie",1800.0,1800.0,,45.0,40.0,True,"(50.31724945, 19.138881491319484)",32
"Śródmieście, Bytom, śląskie","Bytom, śląskie",1650.0,1650.0,,21.43,77.0,True,"(50.3593826, 18.9223843)",26
"Hutki, Konopiska, częstochowski, śląskie","częstochowski, śląskie",1700.0,1700.0,,24.29,70.0,False,"(50.6812992, 19.0069168)",35
"Sielec, Sosnowiec, śląskie","Sosnowiec, śląskie",2200.0,2200.0,,44.9,49.0,True,"(50.2761303, 19.1408973)",37
"ul. Francuska, Osiedle Paderewskiego-Muchowiec, Katowice, śląskie","Katowice, śląskie",1800.0,1800.0,,60.0,30.0,False,"(50.2576071, 19.0171456)",38
"Centrum, Chorzów, śląskie","Chorzów, śląskie",2000.0,1800.0,200.0,68.97,29.0,True,"(50.2916931, 18.942978)",39
"ul. Augustyna Świdra, Chorzów II, Chorzów, śląskie","Chorzów, śląskie",1300.0,1300.0,,32.5,40.0,True,"(50.2537455, 18.9383126)",40
"ul. Augustyna Świdra, Chorzów II, Chorzów, śląskie","Chorzów, śląskie",1300.0,1300.0,,32.5,40.0,True,"(50.2537455, 18.9383126)",40
"ul. Tysiąclecia, Osiedle Tysiąclecia, Katowice, śląskie","Katowice, śląskie",2250.0,2250.0,,44.12,51.0,True,"(50.2576071, 19.0171456)",38
"ul. Ceglana, Brynów-Osiedle Zgrzebnioka, Katowice, śląskie","Katowice, śląskie",2550.0,2550.0,,75.0,34.0,False,"(50.2576071, 19.0171456)",38
"ul. Ignacego Chrzanowskiego, Śródmieście, Bytom, śląskie","Bytom, śląskie",1460.0,1300.0,160.0,54.07,27.0,True,"(50.342812, 18.9120743)",31
"Śródmieście, Bytom, śląskie","Bytom, śląskie",1100.0,1100.0,,30.56,36.0,False,"(50.3593826, 18.9223843)",26
"ul. Francuska, Osiedle Paderewskiego-Muchowiec, Katowice, śląskie","Katowice, śląskie",3150.0,2500.0,650.0,78.75,40.0,True,"(50.2576071, 19.0171456)",38
"Śródmieście, Bytom, śląskie","Bytom, śląskie",2101.0,2100.0,1.0,18.93,111.0,False,"(50.3593826, 18.9223843)",26
"Sielec, Sosnowiec, śląskie","Sosnowiec, śląskie",1650.0,850.0,800.0,43.42,38.0,False,"(50.2761303, 19.1408973)",37
"Centrum, Siemianowice Śląskie, śląskie","Siemianowice Śląskie, śląskie",1800.0,1800.0,,64.29,28.0,True,"(50.2951929, 19.035367665389575)",34
"ul. Katowicka, Śródmieście, Bytom, śląskie","Bytom, śląskie",1000.0,750.0,250.0,66.67,15.0,True,"(50.342812, 18.9120743)",31
"Centrum / Śródmieście, Sosnowiec, śląskie","Sosnowiec, śląskie",3063.0,2100.0,963.0,42.54,72.0,True,"(50.30136995, 19.137234784534655)",28
"ul. Gajdasa, Radzionków, tarnogórski, śląskie","tarnogórski, śląskie",2100.0,2100.0,,36.84,57.0,False,"(50.441837, 18.8565784)",28
"ul. gen. Kazimierza Pułaskiego 27, Osiedle Paderewskiego-Muchowiec, Katowice, śląskie","Katowice, śląskie",2744.0,2744.0,,44.98,61.0,False,"(50.2576071, 19.0171456)",38
"ul. Tysiąclecia, Osiedle Tysiąclecia, Katowice, śląskie","Katowice, śląskie",2500.0,2500.0,,43.1,58.0,False,"(50.2576071, 19.0171456)",38
"ul. rtm. Witolda Pileckiego, Centrum / Śródmieście, Sosnowiec, śląskie","Sosnowiec, śląskie",1400.0,1400.0,,38.89,36.0,True,"(50.27895, 19.1263859)",35
"Śródmieście, Bytom, śląskie","Bytom, śląskie",1551.0,1550.0,1.0,41.92,37.0,False,"(50.3593826, 18.9223843)",26
"ul. Wyzwolenia, Piekary Śląskie, śląskie","Piekary Śląskie, śląskie",2000.0,2000.0,,26.67,75.0,True,"(50.3686759, 18.9325362)",25
"ul. Juliana Fałata, Śródmieście, Bytom, śląskie","Bytom, śląskie",1400.0,1400.0,,26.42,53.0,False,"(50.342812, 18.9120743)",31
"ul. Juliusza Zarębskiego, Załęże, Katowice, śląskie","Katowice, śląskie",1500.0,1350.0,150.0,65.22,23.0,True,"(50.2576071, 19.0171456)",38
"Stary Sosnowiec, Sosnowiec, śląskie","Sosnowiec, śląskie",1801.0,1800.0,1.0,27.71,65.0,False,"(50.2822072, 19.1189568)",32
"Aleja Wojciecha Korfantego, Śródmieście, Katowice, śląskie","Katowice, śląskie",2200.0,2200.0,,44.0,50.0,False,"(50.2623308, 19.0217115)",38
"Penthouse w Atal Sokolska Towers, Śródmieście, Katowice, śląskie","Katowice, śląskie",11990.0,11990.0,,85.64,140.0,False,"(50.2576071, 19.0171456)",38
"ul. Krzysztofa Kamila Baczyńskiego, Milowice, Sosnowiec, śląskie","Sosnowiec, śląskie",1550.0,1550.0,,46.97,33.0,True,"(50.27895, 19.1263859)",35
"ul. Jana Faski, Centrum, Chorzów, śląskie","Chorzów, śląskie",6500.0,6500.0,,59.09,110.0,True,"(50.2537455, 18.9383126)",40
"ul. Słoneczna, Wełnowiec-Józefowiec, Katowice, śląskie","Katowice, śląskie",1900.0,1900.0,,31.15,61.0,True,"(50.2576071, 19.0171456)",38
