listing,listing,listing,listing,pricing,pricing,pricing,pricing,pricing,pricing,location,location,location,location,size,size,size,size,size,legal_and_availability,legal_and_availability,legal_and_availability,legal_and_availability,type_and_year,type_and_year,amenities,amenities,equipment,equipment,equipment,equipment,equipment,equipment,equipment,equipment,media_types,media_types,media_types,media_types,heating,heating,heating,heating,heating,heating,heating,security,security,security,security,security,security,security,windows,windows,windows,windows,building_material,building_material,building_material,building_material,building_material,building_material,building_material,building_material,building_material,building_material,building_material,additional_information,additional_information,additional_information,additional_information,additional_information,additional_information,additional_information
link,title,summary_description,remote_service,price,rent,total_rent,total_rent_sqm,deposit,deposit_ratio,complete_address,street,city,voivodeship,square_meters,number_of_rooms,floor,attic,building_floors,available_from,completion,ownership,rent_to_students,building_type,build_year,elevator,parking_space,no_information,stove,fridge,furniture,oven,washing_machine,TV,dishwasher,no_information,internet,telephone,cable_TV,no_information,electric,gas,other,boiler_room,district,tile_stove,no_information,intercom_or_video_intercom,anti_burglary_doors_or_windows,monitoring_or_security,anti_burglary_roller_blinds,alarm_system,enclosed_area,aluminum,no_information,wooden,plastic,concrete,aerated_concrete,no_information,brick,wood,other,lightweight_aggregate,hollow_brick,silicate,large_panel,reinforced_concrete,no_information,duplex,air_conditioning,separate_kitchen,basement,utility_room,non_smokers_only
https://www.olx.pl/d/oferta/wynajme-nowy-apartament-w-domu-czterorodzinnym-CID3-IDYhiM9.html,Wynajmę nowy apartament w domu czterorodzinnym,"OpisWynajmę nowy apartament o powierzchni 60,31 m.kw., który znajduje się w Przeczycach (woj. śląskie) na osiedlu Łabędzie w budynku 4-rodzinnym. Mieszkanie znajduje się na pierwszym piętrze, posiada dwa balkony i własną klatkę schodową. Posiada salon z aneksem kuchennym i dodatkowo dwa pokoje oraz WC. Mieszkanie posiada również niezagospodarowane poddasze, które można wykorzystać jako strych bądź schowek.
Opłata miesięczna wynosi 2500 zł plus media.
Ze względu na fakt iż jest to nowy apartament, kaucja wynosi 5000 zł.
Apartament ogrzewany własnym piecem gazowym.
Mieszkanie dostępne jest 'od zaraz' po spisaniu umowy notarialnej na minimum 2 lata.
Osoby zainteresowane proszę o kontakt pod numerem telefonu 60********59",,2500.0,500.0,3000.0,50.0,,,"Przeczyce, Śląskie",,Przeczyce,Śląskie,60,3,1,False,,,,private,,,,False,False,False,False,False,True,False,False,False,False,True,False,False,False,True,False,False,False,False,False,False,True,False,False,False,False,False,False,False,True,False,False,False,False,True,False,False,False,False,False,False,False,False,True,False,False,False,False,False,False
https://www.olx.pl/d/oferta/wynajme-mieszkanie-w-mierzecicach-CID3-IDYEkSL.html,Wynajmę mieszkanie w Mierzęcicach,"OpisWynajmę mieszkanie 2 pokojowe, na 1 piętrze, w pełni wyposażone (jak na zdjęciach), 5 min od lotniska w Pyrzowicach,  
W cenie jest  ujęty czynsz administracyjny, ogrzewanie, zaliczka na wodę. Dodatkowo płatne: gaz, prąd i internet.
Najem okazjonalny.",,2600.0,1.0,2601.0,53.08163265306123,,,"Mierzęcice, Śląskie",,Mierzęcice,Śląskie,49,2,1,False,,,,private,,,,False,False,False,False,False,True,False,False,False,False,True,False,False,False,True,False,False,False,False,False,False,True,False,False,False,False,False,False,False,True,False,False,False,False,True,False,False,False,False,False,False,False,False,True,False,False,False,False,False,False
https://www.olx.pl/d/oferta/mieszkanie-47m2-osiedle-mierzecice-CID3-IDXYspn.html,Mieszkanie 47m2 Osiedle Mierzęcice,"OpisWitam, wynajmę mieszkanie! Mieszkanie jest umeblowane: kuchnia z piekarnikiem, lodówka, pralka. Mieszkanie składa się z dwóch pokoi. Większy pokój wyposażony jest w kanapę, stolik. W sypalni znajduje się dwuosobowe łóżko. Łazienka i kuchnia są całkowicie wyposażone. Mieszkanie posiada balkon oraz piwnicę. 
Wynajem od 02.2024.
Dodatkowe opłaty to: woda, prąd oraz gaz. Cena: 1700. Kaucja: 3000zl.",,1700.0,1.0,1701.0,36.191489361702125,,,"Nowa Wieś, Śląskie",,Nowa Wieś,Śląskie,47,2,1,False,,,,private,,,,False,False,False,False,False,True,False,False,False,False,True,False,False,False,True,False,False,False,False,False,False,True,False,False,False,False,False,False,False,True,False,False,False,False,True,False,False,False,False,False,False,False,False,True,False,False,False,False,False,False
